{
  "endpoint_id": "webhook_endpoint_env_123",
  "organization_id": "org_123",
  "project_id": "project_123",
  "environment_id": "env_123",
  "name": "Smoke Ops Webhook",
  "url": "https://ops.example.test/palimpsest/webhooks",
  "event_types": [
    "managed_postgres.backup.failed",
    "quota_alert.firing"
  ],
  "signing_secret_ref": {
    "secret_id": "secret_webhook_endpoint_env_123",
    "provider": "local-dev",
    "external_ref": "local-dev/webhooks/env_123/ops"
  },
  "status": "active"
}
